"b16045567"	"01-30-2013"	"Project Muse [electronic resource] : scholarly journals online"	""	""	"Available via Internet, http://muse.jhu.edu/"	"Project Muse Standard Collection of core scholarly titles from John Hopkins University. Offers current and back issues. Please note: we do not subscribe to the Premium Collection. We have access to most, but not all, Project Muse titles. Coverage: varies."	"Asian studies"|"English language and literature"|"History"|"Political science"	"View online - Project Muse http://0-muse.jhu.edu.tiger.coloradocollege.edu/browse/titles/all?browse_view_type=list&limit_content_type=journal#limit_access=valid"
"b16053035"	"12-10-2010"	"The American Civil War [electronic resource] : letters and diaries"	""	""	"Available via Internet, http://solomon.cwld.alexanderstreet.com/"	"100,000+ pages of diaries, letters and memoirs by 2000+ authors.  Includes many previously unpublished manuscripts.   Organized for detailed browsing and searching. Some materials are cross-searchable under Social and Cultural History. Coverage: 1848 - 1897"	"History"|"North American studies"	"View online http://0-solomon.cwld.alexanderstreet.com.tiger.coloradocollege.edu/"
"b16053047"	"12-10-2010"	"American film scripts [electronic resource]"	""	""	"Available via Internet, http://solomon.afso.alexanderstreet.com/"	"American Film Scripts Online contains over 1000 scripts, together with detailed, fielded information on the scenes, characters and people related to the scripts. In addition, the database includes facsimilie images for more than 500 of these screenplays. Many of the scripts have never been published before, and some scripts were never produced. Coverage: 1903 - current"	"English language and literature"|"Film"	"View online http://0-solomon.afso.alexanderstreet.com.tiger.coloradocollege.edu/"
"b16053059"	"12-10-2010"	"Asian American drama [electronic resource]"	""	""	"Available via Internet, http://solomon.aadr.alexanderstreet.com/"	"250+ plays (some never before published) by 40+ authors together with detailed, indexed information on related productions, theaters, production companies, and more. Cross-searchable under North American Theater Online. Coverage: 1891 - current"	"Asian studies"|"Drama and Dance"|"English language and literature"|"Race and Ethnic Studies"	"View online http://0-solomon.aadr.alexanderstreet.com.tiger.coloradocollege.edu/"
"b16053060"	"09-15-2011"	"Black thought and culture [electronic resource] : African Americans from Colonial times to the present"	"Subtitle <June 16, 2003>: African Americans to 1975"|"Title from HTML source: BLTC"|"Title on internal pages: Black thought & culture"	""	"Available via Internet, http://solomon.bltc.alexanderstreet.com/"	"Black Thought and Culture contains 1,200+ sources covering the non-fiction published works of leading African Americans.  Includes non-fiction works, interviews, journal articles, speeches, essays, pamphlets, letters and other fugitive material.  Also includes the Black Panther newspaper from 1967-1980. Allows for advanced browsing and searching by author, race, gender, year, subject, nationality, etc.  Some materials are cross-searchable under Social and Cultural History. Coverage:  1700 - 2006"	"English language and literature"|"History"|"North American studies"|"Race and Ethnic studies"	"View online http://0-solomon.bltc.alexanderstreet.com.tiger.coloradocollege.edu/"
"b16053102"	"12-10-2010"	"North American immigrant letters, diaries, and oral histories [electronic resource]"	""	""	"Available via Internet, http://solomon.imld.alexanderstreet.com/"	"100,00 pages of letters, diaries, oral histories, interviews and other personal narratives by 2,000+ authors.  Some audio recordings are available.  Material is organized for advanced browsing and searching.  Some materials are cross-searchable under Social and Cultural History. Coverage: 1784 - 2004"	"History"|"North American studies"|"Race and Ethnic Studies"|"Southwest studies"	"View online http://0-solomon.imld.alexanderstreet.com.tiger.coloradocollege.edu/"
"b16053114"	"12-10-2010"	"Early encounters in North America [electronic resource] : peoples, cultures, and the environment"	"EENA"|"Jesuit relations and allied documents"	""	"Available via Internet, http://eena.alexanderstreet.com/"|"System requirements: Internet access and World Wide Web browser"	"Full text works by 1,400+ authors in the form of letters, diaries, memoirs and accounts of early encounters between American Indians, Europeans, Americans, and Africans in all areas of North America.  Offers advanced searching and browsing of people, events, flora, fauna and more. Coverage: 1474 - 1800's"	"History"|"North American studies"|"Race and Ethnic Studies"|"Southwest studies"	"View online http://0-eena.alexanderstreet.com.tiger.coloradocollege.edu/"
"b16079206"	"05-27-2008"	"PsycARTICLES [electronic resource]"	"Psyc articles"|"At head of title: EBSCOhost research databases"	""	"Available via Internet, http://search.ebscohost.com/login.aspx?authtype=ip,uid&profile=ehost&defaultdb=pdh"	"Full text articles on current issues in psychology, general psychology, and specialized, basic, applied, clinical and theoretical research in psychology, covering journals published by the American Psychological Association and other allied organizations. NOTE: You can search both PsycINFO and PsycARTICLES at the same time. Contact Reference Desk x6662. Coverage: 1988 - current"	"Education"|"Feminist and gender studies"|"Health and medicine"|"Natural sciences"|"Psychology"|"Sport science"	"http://0-search.ebscohost.com.tiger.coloradocollege.edu/login.aspx?authtype=ip,uid&profile=ehost&defaultdb=pdh View online"
"b16084524"	"06-15-2011"	"The Gallup brain [electronic resource]"	"Gallup organization brain"|"Gallup poll"	""	"Available via Internet, http://institution.gallup.com/"	"A searchable, living record of more than 60 years of public opinon. Find answers to more than 125,000 questions and responses from more than 3.5 million people interviewed by The Gallup Poll since 1935. Coverage: 1935 - current"	"Political science"|"Sociology"	"View online http://0-institution.gallup.com.tiger.coloradocollege.edu/"
"b16097063"	"03-26-2012"	"Colorado historic newspaper collection [electronic resource]"	"HTML source title: Colorado historical newspaper collection--Project site <2004>"|"Also called: CHNC"	""	"Available via Internet, http://www.coloradohistoricnewspapers.org/"|"System requirements: Internet connectivity and browser software. Optimized for Microsoft Internet Explorer 5.0 (and above) for Microsoft Windows"	"Search historic Colorado newspapers from cities and counties throughout the state, published in English and other languages. The database includes digital versions of newspapers found on microfilm at the Colorado Historical Society's Stephen H. Hart Library that were published between 1859 and 1928. New material is usually added once a month. Some issues of the Colorado Springs Gazette are included. Coverage: 1859 -"	"History"	"http://www.coloradohistoricnewspapers.org/ View online"
"b16097294"	"08-19-2008"	"Energy citations database [electronic resource] : 1948-present"	"Title from HTML source code header: Energy citations database (ECD)--energy and energy-related bibliographic citations"|"ECD"|"Energy and energy-related bibliographic citations"	""	"Mode of access: Internet from the OSTI web site. Address as of 2/26/04: http://www.osti.gov/energycitations/; current access is available via PURL"	"Access to science research citations and electronic documents of scientific and technical research results in disciplines of interest to DOE such as chemistry, physics, materials, environmental science, geology, engineering, mathematics, climatology, oceanography, computer science and related disciplines. It includes bibliographic citations to report literature, conference papers, journal articles, books, dissertations, and patents; primarily from 1943 forward."	"Government information"	"View online http://purl.access.gpo.gov/GPO/LPS21457"
"b16180343"	"07-13-2011"	"Communication & mass media complete [electronic resource]"	"Communication and mass media complete"|"About page added title: CMMC"	""	"Available via Internet, http://search.ebscohost.com/login.asp?profile=web&defaultdb=ufh"	"Covers all areas of communication and mass media. Includes full text for over 200 titles and citations to research journals, as well as major journalism reviews, recent encyclopedias, and handbooks in the area of communications studies. Some journals are indexed back as far as the early decades of the 20th century. Coverage: Early 20th century - current"	"Communication"|"Television"	"View online version http://0-search.ebscohost.com.tiger.coloradocollege.edu/login.asp?profile=web&defaultdb=ufh"
"b16204803"	"08-01-2012"	"Los Angeles times (Historical) [electronic resource]"	"Historical Los Angeles times 1886-1984"|"Historical Los Angeles daily times 1886-1984"|"Proquest Los Angeles times"	""	"Available via Internet, http://search.proquest.com/hnplatimes/advanced?accountid=10222"|"Available via Internet, http://web.lexis-nexis.com/universe"	"Provides complete, full-image access to historical articles from the Los Angeles Times from its inception. For current online articles, use Lexis-Nexis Academic Universe. Coverage: 1881 - 1988."	"History"|"Political science"	"View online - Articles from 1881 -  http://0-search.proquest.com.tiger.coloradocollege.edu/hnplatimes/advanced?accountid=10222"|"View online - Current articles http://0-web.lexis-nexis.com.tiger.coloradocollege.edu/universe"
"b16214705"	"06-15-2011"	"ARTFL project, University of Chicago [electronic resource]"	"ARTFL"|"ARTFL : American research on the treasury of the French language"	""	"Available via Internet, http://humanities.uchicago.edu/orgs/ARTFL/"	"Consists of nearly 2000 French texts. Subjects include literary criticism, biology, history, economics, and philosophy. Genres include novels, verse, theater, journalism, essays, correspondence, and treatises. The 18th, 19th and 20th centuries are about equally represented, with a smaller selection of 17th century texts as well as some medieval and Renaissance texts. Coverage: Medieval to 20th Century"	"Comparative literature"|"English language and literature"|"French language and literature"|"Philosophy"|"Political science"	"http://0-humanities.uchicago.edu.tiger.coloradocollege.edu/orgs/ARTFL/ View online"
"b16223780"	"04-23-2009"	"ARTstor [electronic resource]"	"ART stor"	""	"Available via Internet, http://www.artstor.org/"	"Hundreds of thousands of digital images with descriptive information covering painting, sculpture, photography, decorative arts, architecture, and design, as well as many other forms of worldwide visual culture. Save groups of images for later use in ARTstor, or download or print to use in class projects, presentations, and papers. First-time users must register for an account from a computer on campus. Coverage: Prehistory - current"	"Art"	"View online version - ARTstor http://www.artstor.org/"
"b16230930"	"03-19-2009"	"Early English books online [electronic resource]"	"EEBO"	""	"Available via Internet, http://eebo.chadwyck.com/home"	"Contains the full text of over 100,000 English books, pamphlets, and more, from the first book published in English through the age of Spenser and Shakespeare. Coverage: 1475 - 1700"	"Drama and Dance"|"English language and literature"|"History"|"Philosophy"	"View online http://0-eebo.chadwyck.com.tiger.coloradocollege.edu/home"
"b16322095"	"08-19-2008"	"ERIC database [electronic resource]"	"Title appears on home page as: Welcome to the ERIC database"|"Title on title bar: Education Resources Information Center : ERIC"|"ERIC"	""	"Mode of access: Internet from the U.S. Dept. of Education Web site. Address as of 09/29/04: http://www.eric.ed.gov/; current access is available via PURL"	" Bibliographic records of journal articles and other education-related materials, with hundreds of new records added twice weekly."	"Government information"	"View online http://purl.access.gpo.gov/GPO/LPS54302"
"b16331187"	"02-22-2013"	"Mergentonline [electronic resource]"	"Mergent online"|"Previously titled: FISOnline"	""	"Available via Internet, http://www.mergentonline.com/compsearch.asp"	"U.S. and International company and industry information. 15 year financial backfile. Reports can be downloaded into Excel. Coverage: 1989 - current"	"Economics and business"	"View online http://0-www.mergentonline.com.tiger.coloradocollege.edu/compsearch.asp"|"To download large data sets, please use on campus with this URL:  http://www.mergentonline.com/compsearch.asp"
"b16403356"	"08-07-2007"	"IoP electronic journals [electronic resource]"	"I o P electronic journals"|"Institute of Physics electronic journals"|"Title from HTML header: Electronic journals from the Institute of Physics publishing"|"IOP archives"|"Colorado College: Institute of physics historic archive"	""	"Available via Internet, http://www.iop.org/EJ/search"	"Full text articles of over 70 journals from their inception, dealing with all areas of physics, pure and applied. Coverage: 1874 - current"	"Natural sciences"|"Physics"	"View online - IOP Archives http://0-www.iop.org.tiger.coloradocollege.edu/EJ/search"
"b16456130"	"08-16-2011"	"Physical review online archive [electronic resource] : PROLA"	"Colorado College: PROLA"	""	"Available via Internet, http://prola.aps.org/search"	"PROLA is the Physical Review Online Archive, which includes the full-text of articles from Physical Review Letters, Reviews of Modern Physics, and the Physical Review series from their inception up to the most recent 3 years. Coverage: 1893 - most recent 3 years"	"Natural sciences"|"Physics"	"View online - Current three years before current year http://0-prola.aps.org.tiger.coloradocollege.edu/search"
"b16485609"	"08-01-2012"	"PAIS International [electronic resource]"	""	"Also available in a print edition, and multiple electronic versions online and ondisc"	"Available via Internet, http://search.proquest.com/pais/advanced?accountid=10222"	"Articles, books, conference proceedings, government documents, book chapters, and statistical directories about public affairs. Coverage: 1915 - current"	"Economics and business"|"Government information"|"Political science"	"View online http://0-search.proquest.com.tiger.coloradocollege.edu/pais/advanced?accountid=10222"
"b16544936"	"10-21-2011"	"In the first person [electronic resource] : an index to letters, diaries, oral histories and personal narratives"	"First person"|"FIRP"	""	"Available via Internet, http://www.inthefirstperson.com/"	"Find primary-source, first person accounts such as oral histories, diaries, etc. Indexes Alexander Street databases (via CC subscription) and material freely available on the Web. Coverage: mostly 19th and 20th century"	"History"	"View online http://0-www.inthefirstperson.com.tiger.coloradocollege.edu/"
"b16561879"	"10-21-2011"	"SocINDEX [electronic resource]"	"Sociological index"	""	"Available via Internet, http://search.ebscohost.com/login.aspx?authtype=ip,uid&profile=ehost&defaultdb=sih"	"Indexes core sociology journals dating back to 1895. More focused on sociology as a discipline than Sociological Abstracts. Coverage: 1895 - current"	"Anthropology"|"Communication"|"Feminist and gender studies"|"Sociology"	"View online http://0-search.ebscohost.com.tiger.coloradocollege.edu/login.aspx?authtype=ip,uid&profile=ehost&defaultdb=sih"
"b16634470"	"08-28-2009"	"Stanford encyclopedia of philosophy [electronic resource]"	""	""	"Available via Internet, http://plato.stanford.edu/contents.html"	"Hundreds of entries on philosophers and philosophical topics, written and updated by experts in the field. Coverage: N/A"	"Philosophy"	"View online http://plato.stanford.edu/contents.html"
"b16658954"	"02-12-2013"	"Sage full text journal collections"	""	""	"Available via Internet, http://online.sagepub.com/"	"Communications, Criminology, Education, Nursing, Management, Material Science, Politics, Psychology, Sociology, Urban Studies periodical collections. Coverage: N/A"	""	"View online http://0-online.sagepub.com.tiger.coloradocollege.edu/"
"b16658966"	"05-18-2011"	"SpringerLink journals"	"Springer and Kluwer journals"	""	"Available via Internet, http://www.springerlink.com/journals/"	"A full-text database for journals and books published by Springer. SpringerLink currently offers over 1,250 fully peer-reviewed journals and more than 10,000 books online."	""	"View online http://0-www.springerlink.com.tiger.coloradocollege.edu/journals/"
"b16675629"	"03-20-2012"	"Biennial report to Congress on the status of GPO Access [electronic resource] / a service of the U.S. Government Printing Office"	"GPO Access"|"Web page listing title: GPO Access Biennial Report"	""	"System requirements: Adobe Acrobat Reader (for issues in PDF version)"|"Mode of access: Internet at the GPO Access web site. Address as of 1/2/01: http://www.access.gpo.gov/su%5Fdocs/aces/biennial/index.html ; current access is available via PURL"	"GPO Access Biennial Report includes a description of the functions of the GPO service, including a statement on cost savings in comparison with other forms of information distribution."	"Government information"	"View online http://purl.access.gpo.gov/GPO/LPS169"
"b16750974"	"06-20-2008"	"PubMed [electronic resource] / NCBI, National Library of Medicine"	"Pub Med"|"Title on title bar: Entrez-PubMed"	""	"Available via Internet, http://www.ncbi.nlm.nih.gov/sites/entrez?otool=coloralib"	"PubMed, a service of the National Library of Medicine, includes over 14 million citations for biomedical articles back to the 1950's. It is the public version of Medline and links to many sites providing full text articles and other related resources. Coverage: varies"	"Biology"|"Government information"|"Health and medicine"|"Natural sciences"|"Psychology"|"Sport science"	"View online http://www.ncbi.nlm.nih.gov/sites/entrez?otool=coloralib"|"View online - PURL http://purl.access.gpo.gov/GPO/LPS4708"
"b16764808"	"05-19-2010"	"Bibliography of the history of art [electronic resource] : international bibliography of art"	"BHA"	"Issued also in print and CD-ROM versions"	"Available via Internet, http://library.getty.edu/bha"	"Covers Western art from Antiquity to the present. Indexes more sources than Art Abstracts, but does not cover Asian art, and does not have full text articles. No longer updated. Coverage: 1973 - 2010"	"Art"	"View online http://library.getty.edu/bha"
"b16778297"	"01-16-2008"	"Humanities international complete [electronic resource]"	""	""	"Available via Internet, http://search.epnet.com/login.asp?profile=web&defaultdb=hlh"	"A comprehensive humanities database, with almost 500 full text titles and indexing and abstracting for more than 1,700 titles. Subject areas include (but are not limited to) literature, philosophy, the arts, history, culture-oriented and multi-disciplinary humanities titles with some coverage going back as far as 1929. This database replaces Humanities Abstracts. Coverage: 1929 - current"	"Anthropology"|"Art"|"Chinese language and literature"|"Classics"|"Communication"|"Comparative literature"|"Drama and Dance"|"English language and literature"|"Film"|"French language and literature"|"German language and literature"|"History"|"Italian language and literature"|"Japanese language and literature"|"Music"|"Philosophy"|"Religion"|"Russian language and literature"|"Russian and Eurasian studies"|"Spanish language and literature"	"View online http://0-search.epnet.com.tiger.coloradocollege.edu/login.asp?profile=web&defaultdb=hlh"
"b16807893"	"10-21-2011"	"Web of science [electronic resource]"	"At head of title: ISI web of knowledge"|"Previously known as: Institute for Scientific Information web of science"|"Colorado College: Social sciences citation index"|"Colorado College: Arts & humanities citation index"|"Colorado College: Science citation index expanded"	""	"Available via Internet, http://apps.webofknowledge.com"	"Citation-based searching in all disciplines. Includes Science Citation Index (1900-present), Social Sciences Citation Index (1900-present), and Arts & Humanities Citation Index (1975-present). Web of Science differs from Web of Knowledge by focusing on these three indexes. Coverage: 1900 - current"	"Agriculture and forestry"|"Anthropology"|"Biology"|"Computer science"|"Economics and business"|"Education"|"Environmental sciences"|"Geology"|"Health and medicine"|"History"|"Mathematics"|"Natural sciences"|"Physics"|"Political science"|"Psychology"|"Chemistry"	"View online http://apps.webofknowledge.com/WOS_GeneralSearch_input.do?highlighted_tab=WOS&product=WOS&last_prod=WOS&search_mode=GeneralSearch"
"b16832590"	"10-21-2011"	"Historical statistics of the United States : earliest times to the present / Susan B. Carter ... [et al.]"	"Historical statistics of the United States"|"Historical statistics of the United States millennial edition"	"Available via Internet, http://hsus.cambridge.org/HSUSWeb/HSUSEntryServlet"	""	"Annual time series of the U.S. population, economic indicators, social conditions, and government. From colonial times to the present. Coverage: 1600s - current"	"Economics and business"|"Government information"|"History"|"Sociology"	"View online version http://0-hsus.cambridge.org.tiger.coloradocollege.edu/HSUSWeb/HSUSEntryServlet"
"b16840409"	"08-01-2012"	"Proquest Historical Newspapers Atlanta Constitution [electronic resource]"	"Historical Atlanta Constitution"|"News -- the Historical Atlanta Constitution"|"Colorado College: Atlanta Constitution (Historical)"	"Also issued in print and in microform"	"Available via Internet,  http://search.proquest.com/hnpatlantaconstitution/advanced?accountid=10222"	" The Atlanta Constitution, historically known as 'the voice of the new south.' Contains first hand accounts of the Reconstruction period and post-war South  to early twentieth century. Full image and full text newspaper articles. (Lexis-Nexis provides text coverage from 1991-present.) Coverage: 1868 - 1945"	"History"	"View online - Proquest Database http://0-search.proquest.com.tiger.coloradocollege.edu/hnpatlantaconstitution/advanced?accountid=10222"
"b16840410"	"08-01-2012"	"Historical Chicago Tribune [electronic resource]"	"ProQuest Historical Newspapers Chicago Tribune"|"News -- the historical Chicago Tribune"|"Chicago Tribune"|"Colorado College: Chicago Tribune (Historical)"	"Also issued in print, on microfilm, on CD-ROM, and as an online database"	"Available via Internet, http://search.proquest.com/hnpchicagotribune/advanced?accountid=10222"	"One of the oldest continuously published newspapers in the United States. Historical coverage of prohibition debates, mercantile development of the midwest, westward expansion, Settlement House Movement - Jane Addams, Al Capone, and more. Full image and full text newspaper articles. (Lexis-Nexis provides current text coverage from March 1, 2002-present.) Coverage: 1849 - 1988."	"History"	"View online - Proquest Database http://0-search.proquest.com.tiger.coloradocollege.edu/hnpchicagotribune/advanced?accountid=10222"
"b16840422"	"07-07-2011"	"Film & television literature index [electronic resource]"	"Film and television literature index"|"FTLI"|"CASC"	"New and expanded online version of the print title: Film literature index"	"Available via Internet, http://search.ebscohost.com/login.asp?profile=web&defaultdb=fah"	"Indexes journals covering all areas of film and television, from reviews to film & TV theory to more technical aspects. Coverage:  1980s - current"	"Film"|"Television"	"View online - EBSCO http://0-search.ebscohost.com.tiger.coloradocollege.edu/login.asp?profile=web&defaultdb=fah"
"b1685875x"	"02-08-2013"	"Chicano database [electronic resource]"	"HTML source title: RLG's Eureka"	"Portions of the Chicano Database are available in print format as: the Chicano Periodical Index, covering 1967-1988; the Chicano Index, covering 1989-1993; Arte Chicano : an Annotated Bibliography of Chicano Art, 1965-1981; the Chicano Anthology Index; the Chicana Studies Index : Twenty Years of Gender Research, 1981-1991; and Hispanic Mental Health Research : A Reference Guide, covering 1920-1980"	"Available via Internet, http://search.ebscohost.com/login.aspx?authtype=ip,uid&profile=ehost&defaultdb=chd"	"Interdisciplinary database, indexing all types of materials for Chicano studies (journal articles, books, chapters, and newspaper articles). Coverage: 1960s - current"	"Race and Ethnic Studies"|"English language and literature"|"Southwest studies"|"Spanish language and literature"	"View online http://0-search.ebscohost.com.tiger.coloradocollege.edu/login.aspx?authtype=ip,uid&profile=ehost&defaultdb=chd"
"b16858761"	"12-04-2009"	"Vault online career library [electronic resource]"	"Online career library"	""	"Available via Internet, http://careerinsider.vault.com/wps/portal/careerinsider?parrefer=2371"	"Guidebooks to various aspects of your job search, to different industries, and some major companies. Includes downloadable PDF files of Vault print guides. Coverage: current"	""	"View online http://0-careerinsider.vault.com.tiger.coloradocollege.edu/wps/portal/careerinsider?parrefer=2371"
